web-scraper-order,web-scraper-start-url,link,link-href,comment
1735056604-20,https://transcripts.foreverdreaming.org/viewforum.php?f=1390&start=1014,01x61 - An Angry Showdown! Cross the Red Line!,https://transcripts.foreverdreaming.org/viewtopic.php?t=74241,"End of anger! To cross Red Line! A cemetery of dragons  Not  Not!! Ryuji said to me that if it turned over to the nest of the dragons, it would be better! That cannot be a cemetery! Apis  Ryuji was stray Sennenryu.



Luffy? During 1000 years, it was all alone.



But then Apis became his friend.



Apart from the 1000 years that he lived, it is the time passed with you Apis that he cherished more in the world.



Luffy  You can include/understand what the dragons say? About.



Do not tell conneries.



But, I know what he said! Liar.



Ryuji, liar  It is a nest of dragons.



The nest of the dragons was found, then opens the eyes! Speak to me! You will be better! Ryuji did not lie.



He said that Sennenryu was to turn over to the nest of the dragons every 1000 years to reappear.



Ryuji would be  Look at over there! A Sennenryu baby! Out of my way!!!! Be to you you still there? Ouais.



A little more and I would have drowned.



Admire.



This place is splendid.



Isn't this marvellous? It is the source of the elixir of youth  Ryukotsu! But with of Sennenryu calcified, it is impossible to make an elixir.



Indeed.



But you forget the herd living of Ryukotsu which is there.



By the way, I am tired of this useless battle.



Why this treasure would not be divided? Not question! You do not wish the eternal life? I am not interested.



Liar!!! There is not only one man who is not frightened by death! And for you and me which ate a Fruit of the Demon, the border is very thin of this world with demise! It is impossible that you would not be frightened by death! It is what you believe  But if this type is exposed there, he will die with the smile with the lips.



I see.



Then very well! You can sit down there and look at, while I only assert Ryukotsu for me! Not! Remain in your place, small plague! Apis! Usopp! Would not be so carefree, Apis! I owe it even if it is imprudent! It is a place crowned for Sennenryu! I will protect this place  for always!!!!! You want to always prevent me? Then you all will die here.



Luffy! It is with me.



But, Luffy! I promised.



I cannot about it any more? Would not be if defaitist! Our goal yet was not achieved! One will go to the nest of the dragons, not truth? I do not want to hear any more of  I cannot about it any more ! You know that I am right.



You do not have to worry for Apis! It is all that you can do, man-rubber band? And now, ultimate technique of the kamaitachi.



It does not matter where you will hide, you will not be able to escape from it.



I wonder whether you will be able to support it.



It is foutu.



Is Luffy in danger? Luffy  I will not flee to hide! Poor idiot! I will cut you of pieces! It is what it  and  I gained! One succeeded!! It is what all that? They really exist? Then it was not a legend? I suppose that it will be réengloutir again like before.



When will that occur, Sennenryu will set out again, hein? This Sennenryu baby will go elsewhere also, I suppose  Then, would you like to pass to the house to taste my famous butaman? Oh, one would have really liked, but one must refuse.



We are pressed a little, you see.



One is it? I wanted to test  Thank you for the proposal, but one must leave.



Oh, as it is damage.



That would have taken three days to prepare them.



And meanwhile, I would have told you the history of the royalty of Lost Island.



Oh, one already heard this history.



Super! Full sail towards Large Line! Do Apis, you want to come? I spent much pleasant moments with you the guy, I would like but I must remain here on this island.



I want to learn some a little more on our habits with Grand-Père Bokuden.



And just like our ancestors who protected Sennenryu, I will protect the nest from the dragons.



I will wait the day when the babies dragons will turn over on the island.



Wait one minute  The next time they will return in  It would not be in 1000 years? Do not say anything which could ruin its dreams.



I know that I will not be able to see the babies dragons when they will grow, but my children, or their children will be able.



And we will protect this island forever! You are odd! You them guy you made odd tricks the every day, not truth? It is true? Goodbye, Apis! Apis! Do not forget me! The honest warrior of the seas, Usopp-Sama! Bye Bye! Bye Bye! Everyone! Made attention with you!! You too! Make attention with you, Apis! Bye! Bye Bye! Bye Bye! You believe that Apis will go well all alone? Apis will manage.



It is perhaps small, but it is crafty one and courageous.



She will go well.



You are right, Nami-San.



It is perfect.



Ouais.



Is Apis our friend, not true? It is certain.



You did not want to leave with them, Apis? If I had left with them, I should have followed their road.



Out, there are things which I want to make here! I am about to do something of incredible.



If I had not met Luffy and his crew, I would never have thought that I could have protected this island.



I would have even thought that to protect it was impossible.



However when Luffy and its crew took Ryuji with them to seek it, they never believed that impossible.



If you really believe in your convictions and that you fight until the end, you can achieve anything.



It is that which they taught me.



They said that to help their friends they put all their heart at it.



They risk their lives for that.



And now, I am me also become their friend! Then I will give all that I have! He fell asleep  He, could you help me to achieve my dreams? Thank you! Allons-y! While speaking about that, if you intend to protect Lost Island, you will need to learn from the things on our ancestors.



Let us start with the first king.



That is enough, I do not need to hear it! Apis, return by here! Stop!! Wait! You must listen to me.



Nooooonnnnn!!!! Apis! Nami-San! With the report/ratio my love! I see enormous clouds mortals right in front of, with a storm right in lower part.



I suppose that we returned on our road.



We should see Red Line soon.



One goes finally worms Grand Line! He, Sanji! One goes there! One goes there! One goes there! Stop that! Afflicted  Zoro! But  One goes there! One goes there! One goes there! is the chart correct? Stop that!! Look at that.



I had heard rumors, but it is also written here on the chart.



If it is true, then the entry of Large Line is a mountain.



A mountain? You want to say that one will run up against a mountain? Good blood  I also thought that it was madness, but  there are channels drawn along the wall of the mountain.



That means that one must climb it.



That seems amusing! About what you do speak? Even if there are channels, it is impossible for a boat to climb a mountain.



But it is what the chart says.



Of course! It is impossible that Nami-San is mistaken! You stole the chart in Buggy, not true? You have really confidence? Zorooo! I with this blasted rudder helps! Sanji-Kun, Usopp, do you want will help? I do not manage to think with this din.



Sanji, come to help me! Yes, Nami-San! One goes there! What? The current is too much strong! Do Usopp, repeat to me that? I said that the current is too much strong! The current  I included/understood! Included/understood what? One must really climb the mountain.



You did not already say that? Look by here.



Listen.



There is no doubt, the  light which us guide  is indicated here.



Here on Red Line, Mountain Reverse.



He! I am supposed to do what here? You see the channel here? If a high tension current coming from one of the quatres oceans runs out towards this mountain, the current quatres will climb the mountain, will meet at the top and will run out directly in bottom towards Grand Line.



After Reverse Mountain  Winter Island is , the currents which enter in collision with Red Line circulate of bottom towards the surface of the ocean.



If we do not manage to enter the channel, the Vogue-Merry will be crashed to pieces on Red Line and the boat will be destroyed.



There will remain nothing any more but remains on the ocean.



Included/understood? I see! Then it is a Mysterious Mountain, it is that? I suspected well that you would not have included/understood anything.



In any case, this boat follows already one of these currents.



Thus if one manages to preserve this direction, one will be able to succeed in assembling Reverse Mountain intact.



Nami-San, you are incredible! I never heard that.



Boats which climb mountains.



I heard something.



On the Mysterious Mountain? Not.



Only that half of those which tried to return on Grand Line died about it.



Then I know that it will not be easy to return there.



Sanji-Kun, the sail please! Immediately, Nami-San! Luffy, moves your bottom from here! He! I can see Reverse Montain! What? It is immense! The entry towards Large Line.



Then it is Red Line, hein? You cannot even see the top beyond the clouds!! One will be made aspire!! Seize the rudder! Let make me! We have it! N-Nami! Where is the entry? If one quickly does not change a course, one will sink right in cliff! This crack in cliff  Nami, which do we have to make? Maintain the course! Be sure for you? Do it! Is Nami, it the entry of the channel? Perhaps  Unthinkable  Water climbs really the mountain.



Do you ensure that one passes between these gates, Ok? If it is not the case, the boat will be tiny room of pieces! We derive! More towards the line! On the right, on the right! On the right? Ok, with starboard all! The rudder!!! Luffy!! My hand catches! One succeeded!!!! And now, straight until the top! Super! He, I want to see that too! Incredible! Dirty bastard! The type of the fruit of Okama  Bastard, you are still in life? You never give up? The farm! You cross me for the last time  Because of you my dream to obtain from Ryukotsu is foutu! But I will not let that finish like that!! I will have at least the pleasure of empocher the 30.



000.



000 Go maintaining! What do we have to make? If it uses its kamaitachi here, one cannot know what it will cut! There is no place where to go  Well! Not only one among you cannot pose the little finger on me! Ah! Of Ryukotsu! Bye Bye! Oh! One did not think of that! Now that it is an anvil, it will be able to annoy us never again! Even if it could swim, the current is agitated too much! That it is my Nami-San! One arrived to the clouds! Incredible!! One is above the clouds! Look at! The top of the mountain! It is the top! Yahoo!! Mihawk is here  Readier of All Blue  A chart supplements  To prove that I am the bravest pirate  I can see it, the largest ocean of the world  Large Line! And some share at the horizon, One Piece awaits us! Ahead!!!"
1735056612-21,https://transcripts.foreverdreaming.org/viewforum.php?f=1390&start=1014,02x62 - The First Obstacle? Giant Whale Laboon Appears,https://transcripts.foreverdreaming.org/viewtopic.php?t=74341,"''Upper Yard'' ''Lovely Street''

''Angel Beach''



Impact!



Sanji!



Life is suffering.



Now, for the other two!



'Kay, let's do this! Center of the ship!



I'll put it on the main mast,

so if anyone's in trouble,



they can get the whistle from here and blow it!



Now it's fair!



A-All right! Good thing this was here!



Huh? You're the only sacrifice I get to k*ll?



''Chopper in Danger!

Former God vs. Priest Shura''



What do you think? Don't they look amazing?



Huh?



This year's pumpkins are very good.



''Knight''

This year's pumpkins are very good.



This year's pumpkins are very good.



Yes...



I don't know what to say

to express my gratitude.



I'm sorry. Now I am staying with you, as well.



If they decide that your daughter

let those straw hat fellows escape,



they'll consider you an accomplice.

So you'll be in danger as well.



This time is on the house...



Eneru's Mantra does not reach this far.



How are things on Angel Island?



Yes?



I'm referring to crops.

How are this year's crops coming?



Yes, I hear they're coming along quite well.



Is that right? I'm glad to hear that.



This is juice made from the

pumpkins that I grew in my field.



It tastes good.



Yes. I'm sorry. Thank you.



Conis-san, have some, too.



Young lady, are you aware that there are

those called pirates in the Blue Sea?



No.



They are criminals who travel on the blue sea.



Their ships all fly a black flag with a skull on it,

although each pirate's flag is different.



Those straw hat fellows

are probably pirates, too.



My word! Are you saying that

they were already criminals?!



Well... It is probably true that they

do not live by the rules of the Blue Sea.



In any society, there are always

those who don't blend in.



Right now, how are you any different?



Who can say for certain that society is right

and that those who don't blend in are wrong?



Sometimes it's not so clear-cut.



To put it in extreme terms, a ''hero'' in wartime



is simply a k*ller if he lives in a different time.



I also have a pirate friend.



He came here when I was still

God over twenty years ago.



He was quite the big-hearted

and pleasant fellow.



I hated to say goodbye.



Right now, though it doesn't

look it at first glance,



Skypiea is a land of endless battles.



A land where battles between

those of us from the sky



and Shandians, also known as

guerrillas, rage continuously.



The Shandians are still challenging Eneru.



Your attempt to coexist with the

Shandians when you were God



offered hope that the several-hundred-year w*r



would end in peace.



Yes... I was very close to succeeding,



but my status as God was taken away by Eneru.



I'm sorry. Everything went

down the drain because of that.



Wh-What're you saying?!

There's no need to apologize.



In Skypiea, there is this legend

passed down from long ago.



Long ago, on the day that Upper Yard,

the sacred ground, was born,



the island's beautiful singing

voice enveloped Skypiea.



That's when the battle between the

Shandians and those from the sky began...



...as if that voice was a cue.



So, when we hear the ''island's singing voice,''



the legend says that this battle will end.



The island's singing voice?



That's right.



The sacred ground will sing again...



...someday, for sure.



What's the matter?



Please look after this place. I've got a job.



Let's go, Pierre!



Father, what tasty pumpkin juice this is!



Yes... I'm really glad...



...that you can enjoy it.



''God''



Now, offer your life to God Eneru!



Fire...!



Why do you struggle?



There's no way that you can escape death!



Die gracefully!



What?!



--The ship is...!

--Hmph! So he's gonna get big...



Darn it! Come on!



Hey, hey! Why do you care when there

won't be anyone to get on board?!



You and your friends cannot escape death.



Who the hell are you?!

Stop it! Don't harm them!



Then... offer your life instead!



No!



Stop it! Stop it!



Don't harm the ship! Just don't harm the ship!



Dammit!



You bastard!



You bastard! Stop it already!



I-I'm in charge of this ship!



They asked me to look after it.



Well, what should we do, Fuza?



''Thirty-foot Bird

Fuza''

Well, what should we do, Fuza?



''Thirty-foot Bird

Fuza''



''Thirty-foot Bird

Fuza''

He says not to harm his friends.



He says not to harm his friends.



He says not to damage the ship.



He says he doesn't want to die.



What a dilemma.



''Skypiea Priest

Sky Rider Shura''

What a dilemma.



''Skypiea Priest

Sky Rider Shura''

Such a damned selfish animal!



''Skypiea Priest

Sky Rider Shura''

He really irks me!



''Skypiea Priest

Sky Rider Shura''



Gan Fall...



Hey, Nami! Get a move on!



Shut up! Don't talk to me right now!



What'll you do if I fall?!



Hey! Are you all right?!



Yeah...



...somehow...



My apologies... for troubling you so often.



No problem.



What's wrong? Did you see God or something?



No... a well.



A well?



The ship... your friends... and yourself...



You don't want to lose any of those?



If you want to live so much,

then why are you so weak?!



Stop it! That spear burns things!



Stop it!



Dammit!



You creep!



Wha...?!



Are you trying to live...

without sacrificing anything?



What is this guy?



It's as if he can predict my moves.



For someone to live, another must die.



That's how life is.



Did you know that this is a sacrificial altar?



Y-Yeah! I heard something like that.



It's true. The rest of your group

is desperately trying to get here.



There are four separate areas

that we, the priests, govern.



''Swamp'' ''Iron'' ''String'' ''Ball''

There are four separate areas

that we, the priests, govern.



''Swamp'' ''Iron'' ''String'' ''Ball''

The rule is that when the

targets are in one area,



''Swamp'' ''Iron'' ''String'' ''Ball''

the other priests aren't supposed

to do anything to the targets.



''Swamp'' ''Iron'' ''String'' ''Ball''

But this sacrificial altar doesn't

belong to any of those areas.



''Swamp'' ''Iron'' ''String'' ''Ball''

''Sacrificial Altar''

But this sacrificial altar doesn't

belong to any of those areas.



But this sacrificial altar doesn't

belong to any of those areas.



In other words, it's a free area.



So it doesn't matter who

strikes the ones at the altar.



But it should be after those who're

receiving the ordeal in some area die.



What?! Then, Luffy and the others are...?!



Don't freak out. My coming here doesn't

mean your friends' death... unfortunately...



I came here for a different reason.



What?! A different reason...?



Ah, but does that mean we can also

get out of here if Luffy and the others



come to rescue us?!



Yeah, that's right...



...if you can get out of this free area.



What...?



But, hold that thought.



The reason I came here is because,

although those are the normal judgment rules,



when there's an exceptional situation,

the rules change a little.



Exceptional...



Yes. For example, when three of the sacrifices



escaped to the forest over there

without permission using vines...



I see... that's an exceptio...



God's on this island, right?

I'm gonna go meet him.



He's the culprit!



What's with her, wandering off on her own?



What a selfish woman!



I don't think I could take

being called selfish by you.



Huh?!



Because of you, I feel that I've gone through

so many hardships that I wouldn't have had to.



Err... really?



Someone has to die to atone

for the others' crime of escaping.



Sacrifice is a fact of life.



Especially if they are to come back,



in order that they can more

deeply realize their own fault



when they see their friend's death...



...offer your life... to God!!



No!!



Die!



Sorry to have kept you waiting!



Sky Knight!!



Hmph! Looks like a surprise guest showed up!



Gan Fall!!



Sky Knight!!



He is quite good. He is a worthy opponent.



Let's get rough with him, Pierre.



What's that old previous God doing here?!



Shall we play with him a little, Fuza?!



Just keep barking!



We don't need two Gods on this island!



Go!!



Sky... Knight...!!



We need to give him one

more push, Pierre. Let's go!



You son of a b*tch!



You probably came here knowing this, but...



...you're already a criminal!



Ahh, I'll show you what I do

to aggravating fools like you!!



String Ordeal!



You're still alive?



Impressive indeed!



Well, then, as a reward, I'll give

you my prized finishing blow!



Surprise Balls! Ball Dragon!!"
