web-scraper-order,web-scraper-start-url,link,link-href,comment
1735056755-73,https://transcripts.foreverdreaming.org/viewforum.php?f=1390&start=1014,04x115 - Big Opening Day Today! The Copy-Copy Montage!,https://transcripts.foreverdreaming.org/viewtopic.php?t=74625,"Today the great performance! Basket Basket Assembly! The hopes of the desperate people are being destroyed by a sand cloud.



Some seek hope, and others try to keep a glimmer of hope.



Their ideas were mislaid, and in confusion, the curtain of the history was closed on a tragedy.



Those which try to stop the battle.



Those which try to prolong the battle.



These two camps are gathered in Alubarna! Now, Usopp and Chopper fight against  Mr.



4 and Miss Merry Christmas in a keen fight.



Will Arabasta fall in ruin? Or will it reach a durable peace? God of the destiny counts the seconds before the end.



DO NOT TELL ANYTHING, OLD CRONE! IT    CANNOT HAVE DIED! IT CANNOT HAVE BEEN MADE BEAT BY CROCODILE! Did Ah ouais? And why couldn't it? Because it must become the Lord of the Pirates! It cannot die in this desert like that! S- Lord of the Pirates!? Lord of the Pirates! The lord of Worst the Rats! It is too good, that one! How if a vulgar kid could claim to become the Lord of the Pirates! Mr.



0 made well k*ll it, this small presumptuous! A Ba of less! What a Ba! LISTEN WELL, CHOPPER! A man  It is time to finish some, Long Conk! must sometimes  same if  I it is about to die  to face the wild enemies  Right in hell goes! Usopp! Same if  it knows  that it does not have any chance  Mr.



4! There stop remaining to laugh like an idiot! You put in position! One arrives! USOPP!! It does not matter what the weak ones do, with final they remain weak! Look at it! REFUSE! You ! Hein? You want a piece of it? Be useful yourself.



We will flee with far us planquer like this coward from Long Conk! CLOSE it! Usopp  Usopp is not a coward! There are times    where a man cannot    to move back in front of the combat.



Quoââ?! You are still ! This moment is when his/her companion  when one makes fun of the dream    of my friend! Impossible  Mr.



4 broke cranium with his beater to him! He cannot be in life after that! He should be dead! How it could be raised?! It is still one of its small rounds? Luffy did not die.



I know that he will become the Lord of the Pirates  And it will become it!! And  AND I WILL NOT LET ANYBODY SE MAKE FUN OF HIM! I believe that it did not have its account  One gives that, Mr.



4! Not so quickly! I will not let to you make! Now, you will see  my special point of transformation! USOPP!! It does not matter the force of your will  this time, one does not go you louper! CH CHOPPER! Place  you behind me! Hold good! You are ready with batter, Mr.



4!? Eat that.



They  are with you, Chopper! Well! This dirtiness left its shoes to flee! QU WHAT!? Not, Mr.



4! It is me! He! He the ugly one, looks at what I have for you! One succeeded  Usopp! Usopp! Go, rises! Do not die!! That somebody calls a doctor! Hein? A DOCTEUUURRRRRR!! It is you! Hein? Does Ca go? O- Yes  Kohza! You are well? Yes.



Is this the ball of Nanohana which does you always badly ? It is a battle field, here.



Do not occupy you of that! Most important  I need a horse.



If I can overlap from here in the middle of the city, I will be able to go to the palate in the Northern district! The palate? What do you want to make there? I will summon Cobra to capitulate.



Do not do that! There are Chaka and Pell which order the troops over there in the districts North! They is too dangerous! Our manpower are not complete! The reinforcements coming from the other camps are not yet there! Let us wait, they are too dangerous for them to only act! It is already too late.



Cover me! He, Kohza! Halt! A rebel? This street leads to the palate, the access is prohibited there! You heard me? All the citizens were evacuated! You must leave the city! He, you us listenings, young girl? It is not a cour de recreation, here! I know well! Princess Vivi  Vivi-Sama? Is this Vivi-Sama? Where is my father in this moment? E-Eh well  In this case  Bring me at Chaka! I need him to do something! The dumb ! What a kick ! How can it hold head with my Kenpo Ballet? Bouuuuge out of my cheeemin! You will have initially  to pass to me on the body! Eh well, if you really want it, my cabbage  Each day, each day! Lesson! Lesson! You are not size vis-a-vis my Dancer Kenpo! To try to avoid my fists will change nothing there! This combat does not bring anything to me  I will finish some with a kick! This dumb  He stopped my Shot Sheep  The blow of this cook  cannot equalize my Swan Arabesque  Thus cease having fun! Enough, now I will have it! I am serious! Henceforth, I am serious! Show me that.



You! You still will test my capacities! And nothing is more impressive than my storage capacity! To employ that, for example.



I can create an assembly like this! Once you will have seen this, you will have completely died of laughing! Initially, the strangest head of the world! Then, eyes more mild nutters! Strangest of the noses! The strangest possible mouth! Now, for your visual pleasure  Great Execution Today! Release from there.



It is not a play, dumb! What? You do not have blood or tears!? DEMON! I do not have time for your small performances.



Performances? Nothing! My performances are nothing!! Once, a long ago, I met a man.



And the friendship remained my way of harming to him! I see.








This man in front of me  I believe that I have an idea    is a person! I think that I am in love! I realized  You need me!   of what I must do.



Now, I would like to see you striking one  Q- What is there!? It is the face of your friend, not? You would do that with your friend!? It is sure that are stupid for you.



It does not matter with which you resemble, it is always you of below.



I am not this kind of the type which falls into the panel because of surface images like that.



People    have a heart! People  have a heart  It is if  PURE! I have if shame to take this form  I include/understand.



Even if I    changed me into it.



Mellorine! Mellorine! It does not matter which of your friends I choose  Mellorine! Mellorine!   that will not have any effect.



Mellorine! Mellorine! Too much easy.



Mellorine! Mello  I cannot believe that it either so easy.



Mellorine! Mello  Really so easy? Moron.



It is Vivi-Sama! What? It is true! Is the Princess of return? Why is it here in a similar moment!? Ah, really  You have all your spirit, Vivi-Sama? If we do that  If we do that, what? This country will die? I do not think.



It is not Arabasta.



The kingdom of Arabasta  com carries all those which suffer in this moment! If they are alive, Arabasta will be always a country! The battle must cease, it is all that imports! Please! If I can draw their attention  even for a few moments  I will be able to do something.



I know that I can do something! This palate  Destroy it! Q- What  What do you say? Princess, the palate represents 4.



000 years of history! Do not be insane, Vivi-Sama! Chaka-Sama! I rely on you, but  the King is absent! He would never allow such an egoistic act! But, your Highness  With this pace, the existence even of the kingdom will be in danger! And then? Want you to destroy all the people    without knowing the cause of all that? It is what will destroy the country.



We will take the offensive.



Crocodile is in Rainbase.



With all my respect.



If one att*cks Crocodile now, it will be like putting oil on the fire of the rebellion! While we attack Rainbase, the rebellious army will seize the occasion to strike and occupy the palate! And one does what if the palate falls to the hands from the rebellious army? Even if the royal army were to be destroyed, in five years or more, the country will recover.



We are not those which must be protected! They are the people of this country! Never forget it.



A country    is its inhabitants.



Vivi-Sama  With your orders!"
1735056757-74,https://transcripts.foreverdreaming.org/viewforum.php?f=1390&start=1014,04x116 - Transformed into Nami! Bon Clay's Rapid-Fire Ballet Kenpo!,https://transcripts.foreverdreaming.org/viewtopic.php?t=74626,"The transformation into Nami! Bon Clay strikes with the Kenpo Ballet The hopes of the desperate people are being destroyed by a sand cloud.



Some seek hope, and others try to keep a glimmer of hope.



Their ideas were mislaid, and in confusion, the curtain of the history was closed on a tragedy.



With the variation of the battle, the South-eastern door, Usopp and Chopper started their combat against the human mole, Miss Merry Christmas    and the beater N°4, Mr.



4.



Usopp and Chopper, tired, in extreme cases of their power, finally left victorious.



During this time, Sanji and Mr.



2, Good Clay began their duel.



Continuing to use the capacities of the fruit Basket Basket, Mr.



2, Good Clay    became a serious threat for Sanji! M- Nice! What of the mouth, isn't this? You do not have even any more the force to be raised! Do not believe that I will rest here and take that calmly! It does not matter that you resemble Nami-San, you are always the same idiot inside! Monster of shit! Do not believe yourself if  You! Shit  it is too nice ! Ah, it makes so hot in this country  It would be preferable that I remove this clothing  I can help you?! My eyes! Poor idiot! Your hard words are only stupid charades! Salt dumb  Y' in has to play enough ! You go morfler! Ah! Do not strike me! It is necessary that I begin again my will mascara! I played well with you.



But I must go really there.



We have order to k*ll Princess Vivi, above all.



Thus I will finish some quickly if that does not annoy you! Tournicotis.



Tournicotons! I adore to turn! What do you have says!? To explode the palate!? Yes, we received order to explode the palate.



We will destroy the palate! It is not possible  They are serious? Will they really destroy this palate which crossed the ages during 4.



000 years? Why? In this state    it is hard to find the words.



They is good.



I include/understand.



You had of another choice only to face the rebellious army.



You did an admirable work of maintenance of peace with the rebellion during two years without Igaram.



But, I am certain to be right.



These people whom I met will save Arabasta.



They are friendly truths.



The guy, leave in front! All will go well for me! You ensure that it arrives over there without risk! Bring back Vivi at it! Made blunder! Listen, Vivi.



It will deal with Crocodile.



Time that the rebellious army manages to attack, time for this country is counted.



If the royal army and the army rebel meet, it will be the end of this country.



And if you are the only one who can stop them    then you must remain in life, it does not matter the price to be paid.



Henceforth, no matter what it arrives to us    that does not have any more importance! They wanted to let me have their lives  I hope that they are well  Vivi-Sama  During the two years when I did not see you, you matured well.



When we see finally the end of this conflict, I will want to organize a large banquet in the honor of these pirates.



Chaka  Give me to eat.



Once I will have exploded Crocodile, you will nourish me until I die about it! Yes, I believe in him.



As long as Luffy-San will remain in life, it will be likely to beat Crocodile! Chaka-Sama! What is there? Did you really give the order to destroy the palate!? The soldiers started to gather the gunpowder! There must be an error! I am that which gave this order.



Vivi-Sama! Please, set up all the gunpowder which you can.



To put an end to this useless confrontation, and to save the lives of the people of Arabasta, I will destroy this palate! Hold good! It is not so serious, Usopp! Only tone femur is broken! Your nose and your humérus as your clavicle are almost foutus also  But your state is close to the threshold criticizes  Your blood pressure resembles that of a zombie, but  you do not have absolutely anything to fear! Ah  I feel so well now  I can see a splendid field of flowers! E- Do you see the paradise!? You can see the paradise!? It does not matter the large pirate who you could be, you will always meet the end one day.



Do not die, Usopp  Please, I do not want that you die! Good-bye.



Chopper, I bequeath you my large treasure.



Fifteen gold and silver coins.



Become a large doctor.



Usopp!! Open the eyes! Open them! There is still something which I must say to you! Manjuu.



Manjuu = Japanese traditional In-case lined paste of bean sweetened This manjuu that you were going to eat  I had hidden it.



If I had known that you were going to die, I would have given you half of it.



My heart is so surface and small  Manjuu.



Manjuu  Manjuu  Shit, this idiot! Where devil did it go!? I however said to him to close it and to hide! She is really breakage-testicles! What a stupid woman! It is the end.



I cannot run any more.



I will have to beat me  Or not.



It is time to finish some.



If impatient.



Zoro! The column crumbles all alone! All alone? Not.



I heard the sound of a blade splitting the air.



You me genes.



You, isn't this sliced it? With this arm.



It is a quite strange body which you have there.



Indeed.



I ate the fruit Supa Supa, and since my body is a blade.



It, isn't this was you? The fencer who massacred our 100 employees with Whiskey Peak.



And a few years ago in East Blue, Baroque Works sent Mr.



7 to give    an invitation with a certain hunter of pirates but it seems that he was made k*ll.



It was still you.



He, now I remember some.



It was your fault, you had not accepted my conditions.



I remember of what I had said to your man: If I become the Boss, I unite with you.



 That it is funny.



Instead of accepting my conditions, it tried to k*ll me.



Thus I did what I had to do.



You want to try to recruit me too? I would not like even any more of the armchair now that I know at which point your Boss is stupid.



You want to play the malignant ones with me? Poor epeist of so small and useless crew of pirates.



And you, you looked at yourself well? A puppet without brain deluded by this ideal nation? Unless you would not be empty inside  an empty metal carcass! Miss Doubles Finger.



I will k*ll this type, it is that? Go ahead.



I will see the girl.



He, Nami! She left  Tournicotis.



Tournicotons! And to finish you, my 320.



000 turns  Large Whip! Hold, hold  I have just seen his weak point.



I saw the fault    of its fruit Basket Basket.



I saw the fault of his fruit Mane Basket.



I was right thus.



Considering the fault? It is not true!? How did you can find a weak point with my capacities!? You cannot use your Kenpo Ballet when you take the appearance of Nami-San.



I cannot however still not overcome it.



But at the moment when you are on the point of attacking me, you must take again your true appearance.



By touching your cheek with your left hand, not true? Eh? What did you say? I do not hear you any more! He.



I put in the thousand, one would say.



And then!? You are right, you are right.



Without my sublime body, carved day after day by strict exercises, I cannot control the techniques of the Kenpo Ballet! And then? You are already at the end of the roller! And moreover, wait to see that! Ballet Kenpo Preceded! And I think that you should know that: that on your left is a female    and that on your line is a male.



I of insane! How you want, species of uncultivated! How will you puff out that? What ! It did that of only one kick!? You were right! You were right to avoid it! At the end of this long flexible neck, there is a fatal steel nozzle! There is not the least crack around the hole! By condensing all my power in only one point, I am able to avoid making useless destruction.



One of my kicks is as terrifying as a r*fle shot.



Except that the gauge is a little larger! I will make you full with holes! It is useless! Shit! It has a too long lengthening-piece ! The victory is with me! Jump, change.



I will jump! But, with its lengthening-piece, that will take more time to him to go back in guard.



If I avoid the first blow, I should be able to take it speed.



Now die! Too bad! What do you say that? He! You ace a trick on your left cheek.



Eh? Really? J- I go  Incredible  You are still conscious? What is there? If you took again the appearance of Nami-San, I could not complete you.



Anything.



I cannot move any more.



What would I have to gain by avoiding the final blow? You gained.



k*ll to me.



My destiny was to die for the organization  What do you wait? Go ahead, completes me.



It was a beautiful combat.



Not need to say some more.



It is without any doubt a proof of friendship between rivals  But I should not cry! With more! I take again the glasses of our gunner.



It  completed me  It would be said that I still broke bones  T-all the preparations are ready! We await your orders to light the wicks.



This palate was impregnated 4.



000 years of history of Arabasta.



I am so proud.



But if I destroy the palate, people will stop fighting and will look at me! I will be able to tell them the truth of my own mouth! Light them, now! Q- What is it!? Does that go!?   Sand  They is very tedious  You are rather bold, Miss Wednesday.



Ca will be soon my house, you know.



Crocodile! Your majesty! Father! This palate is not so badly.



I have a superb sight of all these small shits in bottom.



O- Where is Luffy-San? Hein? You want to say Straw hat? This species of beginner  He died."
